<?xml version="1.0"?>
<!--
Copyright (c) 2020-2026 Project CHIP Authors

Licensed under the Apache License, Version 2.0 (the "License");
you may not use this file except in compliance with the License.
You may obtain a copy of the License at

    http://www.apache.org/licenses/LICENSE-2.0

Unless required by applicable law or agreed to in writing, software
distributed under the License is distributed on an "AS IS" BASIS,
WITHOUT WARRANTIES OR CONDITIONS OF ANY KIND, either express or implied.
See the License for the specific language governing permissions and
limitations under the License.
-->
<!--
XML generated by Alchemy; DO NOT EDIT.
Source: src/data_model/Binding-Cluster.adoc
Parameters: zap ignore-errored provisional-policy=loose sdkRoot=./connectedhomeip/ specRoot=./connectedhomeip-spec/ attribute=ambient-context-sensor,ambientsensing,cameras,cameras-image-rotation,groupcast,hrap-pdc,hrap-tbrd,hvac-thermostat-events,hvac-thermostat-suggestions,improved-capabilities-tcr,partitioned-crl,security-sensor-events-tcr,tcr-smokeco-unmounted-state,temperature-alarm,thread-commissioning 
Git: 0.7-recirc-1.7-310-gce68ecc95
Alchemy: v1.7.10
-->
<configurator xmlns:xsi="http://www.w3.org/2001/XMLSchema-instance" xsi:noNamespaceSchemaLocation="../../zcl.xsd">
  <domain name="CHIP"/>
  <struct name="TargetStruct" isFabricScoped="true">
    <cluster code="0x001e"/>
    <item fieldId="1" name="Node" type="node_id" optional="true"/>
    <item fieldId="2" name="Group" type="group_id" optional="true" min="1"/>
    <item fieldId="3" name="Endpoint" type="endpoint_no" optional="true"/>
    <item fieldId="4" name="Cluster" type="cluster_id" optional="true"/>
  </struct>

  <cluster>
    <domain>General</domain>
    <name>Binding</name>
    <code>0x001e</code>
    <define>BINDING_CLUSTER</define>
    <description>The Binding Cluster is meant to replace the support from the Zigbee Device Object (ZDO) for supporting the binding table.</description>
    <client init="false" tick="false">true</client>
    <server init="false" tick="false">true</server>
    <globalAttribute code="0xFFFD" side="either" value="1"/>
    <attribute side="server" code="0x0000" name="Binding" define="BINDING_LIST" type="array" entryType="TargetStruct" writable="true">
      <access op="write" role="manage"/>
      <mandatoryConform/>
    </attribute>
  </cluster>
</configurator>
