<?xml version="1.0"?>
<!--
Copyright (c) 2025-2026 Project CHIP Authors

Licensed under the Apache License, Version 2.0 (the "License");
you may not use this file except in compliance with the License.
You may obtain a copy of the License at

    http://www.apache.org/licenses/LICENSE-2.0

Unless required by applicable law or agreed to in writing, software
distributed under the License is distributed on an "AS IS" BASIS,
WITHOUT WARRANTIES OR CONDITIONS OF ANY KIND, either express or implied.
See the License for the specific language governing permissions and
limitations under the License.
-->
<!--
XML generated by Alchemy; DO NOT EDIT.
Source: src/app_clusters/SoilMeasurement.adoc
Parameters: zap ignore-errored provisional-policy=loose sdkRoot=./connectedhomeip/ specRoot=./connectedhomeip-spec/ attribute=in-progress 
Git: 0.9-1.7-winter2027-349-g23eb5a49a
Alchemy: v1.7.12
-->
<configurator xmlns:xsi="http://www.w3.org/2001/XMLSchema-instance" xsi:noNamespaceSchemaLocation="../../zcl.xsd">
  <domain name="Measurement &amp; Sensing"/>
  <cluster>
    <domain>General</domain>
    <name>Soil Measurement</name>
    <code>0x0430</code>
    <define>SOIL_MEASUREMENT_CLUSTER</define>
    <description>This cluster provides an interface to soil measurement functionality, including configuration and provision of notifications of soil measurements.</description>
    <client init="false" tick="false">true</client>
    <server init="false" tick="false">true</server>
    <globalAttribute code="0xFFFD" side="either" value="1"/>
    <attribute code="0x0000" side="server" name="SoilMoistureMeasurementLimits" define="SOIL_MOISTURE_MEASUREMENT_LIMITS" type="MeasurementAccuracyStruct"/>
    <attribute code="0x0001" side="server" name="SoilMoistureMeasuredValue" define="SOIL_MOISTURE_MEASURED_VALUE" type="percent" isNullable="true"/>
  </cluster>
</configurator>
