<?xml version="1.0"?>
<!--
Copyright (c) 2021-2026 Project CHIP Authors

Licensed under the Apache License, Version 2.0 (the "License");
you may not use this file except in compliance with the License.
You may obtain a copy of the License at

    http://www.apache.org/licenses/LICENSE-2.0

Unless required by applicable law or agreed to in writing, software
distributed under the License is distributed on an "AS IS" BASIS,
WITHOUT WARRANTIES OR CONDITIONS OF ANY KIND, either express or implied.
See the License for the specific language governing permissions and
limitations under the License.
-->
<!--
XML generated by Alchemy; DO NOT EDIT.
Source: src/app_clusters/media/ApplicationLauncher.adoc
Parameters: zap ignore-errored provisional-policy=loose sdkRoot=./connectedhomeip/ specRoot=./connectedhomeip-spec/ attribute=ambient-context-sensor,ambientsensing,cameras,cameras-image-rotation,groupcast,hrap-pdc,hrap-tbrd,hvac-thermostat-events,hvac-thermostat-suggestions,improved-capabilities-tcr,partitioned-crl,security-sensor-events-tcr,tcr-smokeco-unmounted-state,temperature-alarm,thread-commissioning ./connectedhomeip-spec/src/app_clusters/media/ApplicationLauncher.adoc 
Git: 1.6-185-gb051f7083
Alchemy: v1.6.18
-->
<configurator xmlns:xsi="http://www.w3.org/2001/XMLSchema-instance" xsi:noNamespaceSchemaLocation="../../zcl.xsd">
  <domain name=""/>
  <enum name="StatusEnum" type="enum8">
    <cluster code="0x050C"/>
    <item name="Success" value="0x00"/>
    <item name="AppNotAvailable" value="0x01"/>
    <item name="SystemBusy" value="0x02"/>
    <item name="PendingUserApproval" value="0x03"/>
    <item name="Downloading" value="0x04"/>
    <item name="Installing" value="0x05"/>
  </enum>

  <struct name="ApplicationEPStruct">
    <cluster code="0x050C"/>
    <item fieldId="0" name="Application" type="ApplicationStruct"/>
    <item fieldId="1" name="Endpoint" type="endpoint_no" optional="true"/>
  </struct>

  <struct name="ApplicationStruct">
    <cluster code="0x050C"/>
    <item fieldId="0" name="CatalogVendorID" type="int16u"/>
    <item fieldId="1" name="ApplicationID" type="char_string"/>
  </struct>

  <cluster>
    <domain>Media</domain>
    <name>Application Launcher</name>
    <code>0x050C</code>
    <define>APPLICATION_LAUNCHER_CLUSTER</define>
    <description>This cluster provides an interface for launching applications on a Video Player device such as a TV.</description>
    <client init="false" tick="false">true</client>
    <server init="false" tick="false">true</server>
    <globalAttribute code="0xFFFD" side="either" value="2"/>
    <features>
      <feature bit="0" code="AP" name="ApplicationPlatform" summary="Support for attributes and commands required for endpoint to support launching any application within the supported application catalogs">
        <optionalConform/>
      </feature>
    </features>
    <attribute code="0x0000" side="server" name="CatalogList" define="APPLICATION_LAUNCHER_LIST" type="array" entryType="int16u" optional="true">
      <mandatoryConform>
        <feature name="AP"/>
      </mandatoryConform>
    </attribute>
    <attribute code="0x0001" side="server" name="CurrentApp" define="APPLICATION_LAUNCHER_CURRENT_APP" type="ApplicationEPStruct" isNullable="true" optional="true">
      <optionalConform/>
    </attribute>
    <command code="0x00" source="client" name="LaunchApp" response="LauncherResponse">
      <description>Upon receipt of this command, the server SHALL launch the application with optional data.</description>
      <arg fieldId="0" name="Application" type="ApplicationStruct" optional="true"/>
      <arg fieldId="1" name="Data" type="octet_string" optional="true"/>
    </command>

    <command code="0x01" source="client" name="StopApp" response="LauncherResponse">
      <description>Upon receipt of this command, the server SHALL stop the application if it is running.</description>
      <arg fieldId="0" name="Application" type="ApplicationStruct" optional="true"/>
    </command>

    <command code="0x02" source="client" name="HideApp" response="LauncherResponse">
      <description>Upon receipt of this command, the server SHALL hide the application.</description>
      <arg fieldId="0" name="Application" type="ApplicationStruct" optional="true"/>
    </command>

    <command code="0x03" source="server" name="LauncherResponse" disableDefaultResponse="true">
      <description>This command SHALL be generated in response to LaunchApp/StopApp/HideApp commands.</description>
      <arg fieldId="0" name="Status" type="StatusEnum" max="0x05"/>
      <arg fieldId="1" name="Data" type="octet_string" optional="true"/>
    </command>

  </cluster>
</configurator>
