<?xml version="1.0"?>
<!--
Copyright (c) 2021-2026 Project CHIP Authors

Licensed under the Apache License, Version 2.0 (the "License");
you may not use this file except in compliance with the License.
You may obtain a copy of the License at

    http://www.apache.org/licenses/LICENSE-2.0

Unless required by applicable law or agreed to in writing, software
distributed under the License is distributed on an "AS IS" BASIS,
WITHOUT WARRANTIES OR CONDITIONS OF ANY KIND, either express or implied.
See the License for the specific language governing permissions and
limitations under the License.
-->
<!--
XML generated by Alchemy; DO NOT EDIT.
Source: src/service_device_management/PowerSourceConfigurationCluster.adoc
Parameters: zap ignore-errored provisional-policy=loose sdkRoot=./connectedhomeip/ specRoot=./connectedhomeip-spec/ -a access-closure,add-core-modes,add-humidity-controller,ambientsensorfusion,ambientsensingunion,audio-messages,camera-av-analytics,cameras-remote-zones,CurrentHue-scenable,deprecate-im-revision-field,device-location,electrical-sensor-alarm,energy-auxswitch-device-type,energy-electrical-protection,groups-soft-deprecation,hrap-pdc,hrap-proxy,humidistat,hvac-critical-protection,nv-persist-updates,octstr-length-limit,onoff-q-improvement,pqc,predictive-occupancy,q-phase-3,powerrange,proximity-ranging,encrypted-advertising-data,remove-nonvolatile-PS,resource-medium,scenes-fixes,smoke-concentration-tcr,streaming-casting-speakers,tariff-externalid,thermostat-min-setpoint-duration,thermostat-sensors,tstatmode,uwb-ranging,obsolete 
Git: 0.9-1.7-winter2027-349-g23eb5a49a
Alchemy: v1.7.12
-->
<configurator xmlns:xsi="http://www.w3.org/2001/XMLSchema-instance" xsi:noNamespaceSchemaLocation="../../zcl.xsd">
  <domain name="CHIP"/>
  <cluster>
    <name>Power Source Configuration</name>
    <domain>General</domain>
    <description>This cluster is used to describe the configuration and capabilities of a Device&apos;s power system.</description>
    <code>0x002E</code>
    <define>POWER_SOURCE_CONFIGURATION_CLUSTER</define>
    <client init="false" tick="false">true</client>
    <server init="false" tick="false">true</server>
    <globalAttribute side="either" code="0xFFFD" value="2"/>
    <attribute side="server" code="0x0000" name="Sources" define="SOURCES" type="array" entryType="endpoint_no" length="6"/>
  </cluster>
</configurator>
