<?xml version="1.0"?>
<!--
Copyright (c) 2021-2026 Project CHIP Authors

Licensed under the Apache License, Version 2.0 (the "License");
you may not use this file except in compliance with the License.
You may obtain a copy of the License at

    http://www.apache.org/licenses/LICENSE-2.0

Unless required by applicable law or agreed to in writing, software
distributed under the License is distributed on an "AS IS" BASIS,
WITHOUT WARRANTIES OR CONDITIONS OF ANY KIND, either express or implied.
See the License for the specific language governing permissions and
limitations under the License.
-->
<!--
XML generated by Alchemy; DO NOT EDIT.
Source: src/service_device_management/LocalizationConfiguration.adoc
Parameters: zap ignore-errored provisional-policy=loose sdkRoot=./connectedhomeip/ specRoot=./connectedhomeip-spec/ 
Git: 0.9-1.7-winter2027-349-g23eb5a49a
Alchemy: v1.7.12
-->
<configurator xmlns:xsi="http://www.w3.org/2001/XMLSchema-instance" xsi:noNamespaceSchemaLocation="../../zcl.xsd">
  <domain name="CHIP"/>
  <cluster>
    <domain>General</domain>
    <name>Localization Configuration</name>
    <code>0x002b</code>
    <define>LOCALIZATION_CONFIGURATION_CLUSTER</define>
    <client init="false" tick="false">true</client>
    <server init="false" tick="false">true</server>
    <description>Nodes should be expected to be deployed to any and all regions of the world. These global regions
      may have differing common languages, units of measurements, and numerical formatting
      standards. As such, Nodes that visually or audibly convey information need a mechanism by which
      they can be configured to use a user’s preferred language, units, etc</description>
    <globalAttribute code="0xFFFD" side="either" value="1"/>
    <!-- Base data types -->
    <attribute side="server" code="0x00" name="ActiveLocale" define="ACTIVE_LOCALE" type="char_string" length="35" writable="true">
      <access op="write" privilege="manage"/>
      <mandatoryConform/>
    </attribute>
    <attribute side="server" code="0x01" name="SupportedLocales" define="SUPPORTED_LOCALES" type="array" entryType="char_string" length="32"/>
  </cluster>
</configurator>
